{"id":"6104dc7e-45c4-48b1-a382-db3b3b34091f","name":"test1","canvas":{"width":1920,"height":1080,"background":"transparent"},"variables":[{"id":"66651ddc-3ad0-4679-81cf-d0d1ae756fbb","name":"var1","label":"var1","type":"text","defaultValue":"TEST 1"},{"id":"ca0d4dfe-161b-4944-948b-13ea0d96235b","name":"var2","label":"var2","type":"text","defaultValue":"TEXT 1"}],"groups":[{"id":"66bbe0fd-94f5-42c0-b8d8-8d9b2c25731d","name":"Group 1","parentId":null,"visible":true,"locked":false,"transform":{"x":0,"y":0,"width":300,"height":80,"rotation":0,"rotationX":0,"rotationY":0,"perspective":1000,"scaleX":1,"scaleY":1,"anchorX":0,"anchorY":0}},{"id":"01afca11-e4ba-4abd-bf9a-54f70923be25","name":"Group 2","parentId":null,"visible":true,"locked":false,"transform":{"x":0,"y":0,"width":300,"height":80,"rotation":0,"rotationX":0,"rotationY":0,"perspective":1000,"scaleX":1,"scaleY":1,"anchorX":0,"anchorY":0}},{"id":"361760a1-51e6-475d-91fe-e0341b818723","name":"Group 3","parentId":null,"visible":true,"locked":false,"transform":{"x":0,"y":764,"width":300,"height":80,"rotation":0,"rotationX":0,"rotationY":0,"perspective":1000,"scaleX":1,"scaleY":1,"anchorX":0,"anchorY":0}}],"layers":[{"id":"378974ae-83fd-437c-8f53-009fce8d0c30","name":"Rectangle 1","visible":true,"locked":false,"opacity":1,"blendMode":"normal","groupId":"66bbe0fd-94f5-42c0-b8d8-8d9b2c25731d","type":"rect","transform":{"x":52.41319444444444,"y":107.43923611111111,"width":324.64409722222223,"height":140,"rotation":0,"rotationX":0,"rotationY":0,"perspective":1000,"scaleX":1,"scaleY":1,"anchorX":0,"anchorY":0},"fill":"#1f2937","cornerRadius":8,"borderColor":"#000000","borderWidth":0},{"id":"1230dd26-af3f-4a3f-bf71-ffaa0bd94e97","name":"Text 1","visible":true,"locked":false,"opacity":1,"blendMode":"normal","groupId":"66bbe0fd-94f5-42c0-b8d8-8d9b2c25731d","type":"text","transform":{"x":100.26909722222223,"y":120,"width":237.30902777777783,"height":96,"rotation":0,"rotationX":0,"rotationY":0,"perspective":1000,"scaleX":1,"scaleY":1,"anchorX":0,"anchorY":0},"content":{"type":"variable","variableId":"66651ddc-3ad0-4679-81cf-d0d1ae756fbb"},"style":{"fontFamily":"Inter","fontSize":48,"fontWeight":"600","fill":"#ffffff","align":"left","lineHeight":1.1,"letterSpacing":0,"strokeColor":"#000000","strokeWidth":0,"dropShadow":false,"dropShadowBlur":6,"dropShadowColor":"#000000","dropShadowDistance":2}},{"id":"ba5107c9-eff5-4a5a-8062-83a39a934946","name":"Image 1","visible":true,"locked":false,"opacity":1,"blendMode":"normal","groupId":"01afca11-e4ba-4abd-bf9a-54f70923be25","type":"image","transform":{"x":1294.7135416666665,"y":33.75868055555557,"width":553.59375,"height":623.6631944444445,"rotation":0,"rotationX":0,"rotationY":0,"perspective":1000,"scaleX":1,"scaleY":1,"anchorX":0,"anchorY":0},"src":"/uploads/94ae0689-77c4-41fb-89b6-49eb5d5ce280.jpg","cornerRadius":0,"fit":"contain"},{"id":"210ee6a3-4e2d-4f86-8869-77706962c172","name":"Mask 1","visible":true,"locked":false,"opacity":1,"blendMode":"normal","groupId":"01afca11-e4ba-4abd-bf9a-54f70923be25","type":"mask","transform":{"x":1289.5572916666667,"y":16.97916666666667,"width":566,"height":680,"rotation":0,"rotationX":0,"rotationY":0,"perspective":1000,"scaleX":1,"scaleY":1,"anchorX":0,"anchorY":0},"maskMode":"normal","shape":"rect","fill":"#000000","cornerRadius":0,"borderColor":"#000000","borderWidth":0},{"id":"5a89287c-9990-42b7-b2d3-4386bb9fc72f","name":"Clock 1","visible":true,"locked":false,"opacity":1,"blendMode":"normal","groupId":null,"type":"clock","transform":{"x":0,"y":688.2638888888889,"width":300,"height":96,"rotation":0,"rotationX":0,"rotationY":0,"perspective":1000,"scaleX":1,"scaleY":1,"anchorX":0,"anchorY":0},"mode":"clock","format":"HH:mm:ss","style":{"fontFamily":"Inter","fontSize":48,"fontWeight":"600","fill":"#ff4242","align":"center","lineHeight":1.1,"letterSpacing":0,"strokeColor":"#000000","strokeWidth":0,"dropShadow":false,"dropShadowBlur":6,"dropShadowColor":"#000000","dropShadowDistance":2}},{"id":"e4367229-27be-4934-b95c-335dc7d2d53a","name":"Image 2","visible":true,"locked":false,"opacity":1,"blendMode":"normal","groupId":null,"type":"image","transform":{"x":1100,"y":774.1493055555555,"width":808.5329861111111,"height":289.5486111111111,"rotation":0,"rotationX":0,"rotationY":0,"perspective":1000,"scaleX":1,"scaleY":1,"anchorX":0,"anchorY":0},"src":"/uploads/b1936396-f999-4d55-bdae-ec0686653d1c.png","cornerRadius":0,"fit":"cover"},{"id":"30caeeb9-86ca-4c53-9078-3162c2deaf90","name":"Image 3","visible":true,"locked":false,"opacity":1,"blendMode":"normal","groupId":null,"type":"image","transform":{"x":13,"y":422.08333333333337,"width":381.6666666666667,"height":270,"rotation":0,"rotationX":0,"rotationY":0,"perspective":1000,"scaleX":1,"scaleY":1,"anchorX":0,"anchorY":0},"src":"/uploads/0d28e312-5714-44a8-9844-c2d9b003da4d.jpg","cornerRadius":0,"fit":"contain"},{"id":"b48de4c5-2491-4be6-b275-5099592da2a9","name":"Rectangle 2","visible":true,"locked":false,"opacity":1,"blendMode":"normal","groupId":"361760a1-51e6-475d-91fe-e0341b818723","type":"rect","transform":{"x":120,"y":120,"width":480,"height":140,"rotation":0,"rotationX":0,"rotationY":0,"perspective":1000,"scaleX":1,"scaleY":1,"anchorX":0,"anchorY":0},"fill":"#1f2937","cornerRadius":32,"borderColor":"#ff4242","borderWidth":8},{"id":"47a4865c-4f87-4d1c-8770-833682e650b1","name":"Text 2","visible":true,"locked":false,"opacity":1,"blendMode":"normal","groupId":"361760a1-51e6-475d-91fe-e0341b818723","type":"text","transform":{"x":237.80902777777777,"y":135.46006944444446,"width":263.94965277777777,"height":96,"rotation":0,"rotationX":0,"rotationY":0,"perspective":1000,"scaleX":1,"scaleY":1,"anchorX":0,"anchorY":0},"content":{"type":"variable","variableId":"ca0d4dfe-161b-4944-948b-13ea0d96235b"},"style":{"fontFamily":"Inter","fontSize":48,"fontWeight":"600","fill":"#ffffff","align":"left","lineHeight":1.1,"letterSpacing":0,"strokeColor":"#000000","strokeWidth":0,"dropShadow":false,"dropShadowBlur":6,"dropShadowColor":"#000000","dropShadowDistance":2}},{"id":"4f4d7b40-7556-4de2-9795-a16d0e848dd9","name":"Mask 2","visible":true,"locked":false,"opacity":1,"blendMode":"normal","groupId":null,"type":"mask","transform":{"x":-37.795138888888886,"y":984,"width":2015.217013888889,"height":112.40451388888891,"rotation":0,"rotationX":0,"rotationY":0,"perspective":1000,"scaleX":1,"scaleY":1,"anchorX":0,"anchorY":0},"maskMode":"inverted","shape":"rect","fill":"#000000","cornerRadius":0,"borderColor":"#000000","borderWidth":0}],"rootStack":[{"kind":"group","id":"66bbe0fd-94f5-42c0-b8d8-8d9b2c25731d"},{"kind":"group","id":"01afca11-e4ba-4abd-bf9a-54f70923be25"},{"kind":"layer","id":"5a89287c-9990-42b7-b2d3-4386bb9fc72f"},{"kind":"layer","id":"e4367229-27be-4934-b95c-335dc7d2d53a"},{"kind":"layer","id":"30caeeb9-86ca-4c53-9078-3162c2deaf90"},{"kind":"group","id":"361760a1-51e6-475d-91fe-e0341b818723"},{"kind":"layer","id":"4f4d7b40-7556-4de2-9795-a16d0e848dd9"}],"groupStacks":{"66bbe0fd-94f5-42c0-b8d8-8d9b2c25731d":[{"kind":"layer","id":"378974ae-83fd-437c-8f53-009fce8d0c30"},{"kind":"layer","id":"1230dd26-af3f-4a3f-bf71-ffaa0bd94e97"}],"01afca11-e4ba-4abd-bf9a-54f70923be25":[{"kind":"layer","id":"ba5107c9-eff5-4a5a-8062-83a39a934946"},{"kind":"layer","id":"210ee6a3-4e2d-4f86-8869-77706962c172"}],"361760a1-51e6-475d-91fe-e0341b818723":[{"kind":"layer","id":"b48de4c5-2491-4be6-b275-5099592da2a9"},{"kind":"layer","id":"47a4865c-4f87-4d1c-8770-833682e650b1"}]},"timeline":{"fps":50,"durationFrames":500,"playbackMode":"bounded","directors":[{"id":"default","name":"default","durationFrames":200,"offsetFrames":0,"autostart":true,"loop":true,"swing":false}],"trackDirectors":{"66bbe0fd-94f5-42c0-b8d8-8d9b2c25731d":"default","5a89287c-9990-42b7-b2d3-4386bb9fc72f":"default","e4367229-27be-4934-b95c-335dc7d2d53a":"default","30caeeb9-86ca-4c53-9078-3162c2deaf90":"default","361760a1-51e6-475d-91fe-e0341b818723":"default","4f4d7b40-7556-4de2-9795-a16d0e848dd9":"default","210ee6a3-4e2d-4f86-8869-77706962c172":"default"},"keyframes":[{"id":"88d0048d-4d65-4b3e-b082-e247f3ec1ca9","frame":0,"layers":{"5a89287c-9990-42b7-b2d3-4386bb9fc72f":{"x":0},"e4367229-27be-4934-b95c-335dc7d2d53a":{"x":1100},"30caeeb9-86ca-4c53-9078-3162c2deaf90":{"x":14.458333333333334},"4f4d7b40-7556-4de2-9795-a16d0e848dd9":{"y":984},"210ee6a3-4e2d-4f86-8869-77706962c172":{"width":566}},"groups":{"66bbe0fd-94f5-42c0-b8d8-8d9b2c25731d":{"rotation":0,"x":0},"361760a1-51e6-475d-91fe-e0341b818723":{"rotation":0}},"easing":"power2.out"},{"id":"7165bb64-6ce9-4fc2-ab39-fb55009bf4af","frame":50,"layers":{"30caeeb9-86ca-4c53-9078-3162c2deaf90":{"x":300}},"groups":{},"easing":"power2.out"},{"id":"4c40ae02-30a0-414b-9383-d492b108f299","frame":100,"layers":{"5a89287c-9990-42b7-b2d3-4386bb9fc72f":{"x":1600},"e4367229-27be-4934-b95c-335dc7d2d53a":{"x":1950},"30caeeb9-86ca-4c53-9078-3162c2deaf90":{"x":13},"4f4d7b40-7556-4de2-9795-a16d0e848dd9":{"y":-10},"210ee6a3-4e2d-4f86-8869-77706962c172":{"width":0}},"groups":{"66bbe0fd-94f5-42c0-b8d8-8d9b2c25731d":{"rotation":90,"x":1200},"361760a1-51e6-475d-91fe-e0341b818723":{"rotation":69}},"easing":"power2.out"},{"id":"34bb8ea3-ced9-4079-b4c8-315290f2e646","frame":150,"layers":{"30caeeb9-86ca-4c53-9078-3162c2deaf90":{"x":300}},"groups":{},"easing":"power2.out"},{"id":"3a2fcd9d-0bb9-46b4-9117-272d50d53ea7","frame":200,"layers":{"5a89287c-9990-42b7-b2d3-4386bb9fc72f":{"x":0},"e4367229-27be-4934-b95c-335dc7d2d53a":{"x":1100},"30caeeb9-86ca-4c53-9078-3162c2deaf90":{"x":13},"4f4d7b40-7556-4de2-9795-a16d0e848dd9":{"y":984},"210ee6a3-4e2d-4f86-8869-77706962c172":{"width":566}},"groups":{"66bbe0fd-94f5-42c0-b8d8-8d9b2c25731d":{"rotation":0,"x":0},"361760a1-51e6-475d-91fe-e0341b818723":{"rotation":0}},"easing":"power2.out"}],"actions":[]}}